{
  "schemaVersion": "1.0",
  "foundation": {
    "version": "0.2.0",
    "commit": "8ae96c89b5b9df9f2529f462de530d4e63cb8aa8",
    "sourceState": "clean"
  },
  "brief": {
    "sha256": "cc6ae0356a58b6cdc9a8b5f6608b46ec3d5016215bda6204df90795cb201b277"
  },
  "moduleContracts": [
    {
      "id": "baseline-core",
      "version": "0.2.0",
      "readiness": {
        "status": "prebuilt",
        "implementationPaths": [],
        "browserTestPaths": []
      },
      "validation": [
        "pnpm typecheck",
        "pnpm --dir app test:e2e:module"
      ]
    },
    {
      "id": "consent-analytics",
      "version": "0.2.0",
      "readiness": {
        "status": "prebuilt",
        "implementationPaths": [],
        "browserTestPaths": []
      },
      "validation": [
        "pnpm --dir app test:e2e:module"
      ]
    },
    {
      "id": "gallery",
      "version": "0.1.0",
      "readiness": {
        "status": "prebuilt",
        "implementationPaths": [],
        "browserTestPaths": []
      },
      "validation": [
        "pnpm --dir app typecheck",
        "pnpm --dir app test:e2e:module"
      ]
    },
    {
      "id": "lead-form",
      "version": "0.2.0",
      "readiness": {
        "status": "prebuilt",
        "implementationPaths": [],
        "browserTestPaths": []
      },
      "validation": [
        "pnpm --filter @foundation/intake test",
        "pnpm --dir app test:e2e:module"
      ]
    },
    {
      "id": "motion-cursor-surface",
      "version": "1.0.0",
      "readiness": {
        "status": "client-implementation-required",
        "implementationPaths": [
          "app/src/components/motion/cursor-surface.tsx"
        ],
        "browserTestPaths": [
          "app/e2e/modules/motion-cursor-surface.spec.ts"
        ]
      },
      "validation": [
        "pnpm --dir app typecheck",
        "pnpm --dir app test:e2e:module e2e/modules/motion-cursor-surface.spec.ts"
      ]
    },
    {
      "id": "motion-hero-media",
      "version": "1.0.0",
      "readiness": {
        "status": "client-implementation-required",
        "implementationPaths": [
          "app/src/components/motion/hero-media.tsx"
        ],
        "browserTestPaths": [
          "app/e2e/modules/motion-hero-media.spec.ts"
        ]
      },
      "validation": [
        "pnpm --dir app typecheck",
        "pnpm --dir app test:e2e:module e2e/modules/motion-hero-media.spec.ts"
      ]
    },
    {
      "id": "motion-native-scroll-story",
      "version": "1.0.0",
      "readiness": {
        "status": "client-implementation-required",
        "implementationPaths": [
          "app/src/components/motion/native-scroll-story.tsx"
        ],
        "browserTestPaths": [
          "app/e2e/modules/motion-native-scroll-story.spec.ts"
        ]
      },
      "validation": [
        "node --test scripts/motion-reference.test.mjs",
        "pnpm --dir app typecheck",
        "pnpm --dir app test:e2e:module e2e/modules/motion-native-scroll-story.spec.ts"
      ]
    },
    {
      "id": "motion-one-shot-cta",
      "version": "1.0.0",
      "readiness": {
        "status": "client-implementation-required",
        "implementationPaths": [
          "app/src/components/motion/one-shot-cta.tsx"
        ],
        "browserTestPaths": [
          "app/e2e/modules/motion-one-shot-cta.spec.ts"
        ]
      },
      "validation": [
        "pnpm --dir app typecheck",
        "pnpm --dir app test:e2e:module e2e/modules/motion-one-shot-cta.spec.ts"
      ]
    },
    {
      "id": "remote-media-r2",
      "version": "0.1.0",
      "readiness": {
        "status": "client-implementation-required",
        "implementationPaths": [
          "worker/src/remote-media-r2.js"
        ],
        "browserTestPaths": [
          "app/e2e/modules/remote-media-r2.spec.ts"
        ]
      },
      "validation": [
        "pnpm --dir worker test",
        "pnpm --dir app test:e2e:module e2e/modules/remote-media-r2.spec.ts"
      ]
    },
    {
      "id": "showreel",
      "version": "0.1.0",
      "readiness": {
        "status": "client-implementation-required",
        "implementationPaths": [
          "app/src/components/sections/showreel.tsx"
        ],
        "browserTestPaths": [
          "app/e2e/modules/showreel.spec.ts"
        ]
      },
      "validation": [
        "pnpm --dir app typecheck",
        "pnpm --dir app test:e2e:module e2e/modules/showreel.spec.ts"
      ]
    },
    {
      "id": "testimonials",
      "version": "0.1.0",
      "readiness": {
        "status": "prebuilt",
        "implementationPaths": [],
        "browserTestPaths": []
      },
      "validation": [
        "node scripts/check-repo-hygiene.mjs",
        "pnpm --dir app test:e2e:module"
      ]
    }
  ],
  "fixtureContentFingerprints": [
    {
      "sha256": "634c994592e182e3666815b60e7cec0eece3c758f4026146d0ed6762c4a6abc0",
      "tokenCount": 1
    },
    {
      "sha256": "3185b836ae369566440643ec56b93a60477a0bfc9fd615c1dbf085e63299055e",
      "tokenCount": 2
    },
    {
      "sha256": "0064a8f7843b5d049372935009a3b8e40cdef0ffa983dc8dfbd68bffa92b26ab",
      "tokenCount": 3
    },
    {
      "sha256": "07dadc30dcf92a6426c944a89d9532e3b9308f0ab88a2d777b5ff844b62e8552",
      "tokenCount": 3
    },
    {
      "sha256": "23006012451a442c6f63c3822597f081547b87eadaf08525b78d44940775a427",
      "tokenCount": 3
    },
    {
      "sha256": "3ce66127e15a65cd234d6840ecf91a41df3c4918f5d89876d0e5d81a075534e3",
      "tokenCount": 3
    },
    {
      "sha256": "53b853305558b41e0154a5cb7ba799459b780689a9033646f226b54b3c8bea36",
      "tokenCount": 3
    },
    {
      "sha256": "55bbeec22ac967d72a058672b23c7aa63e8a539a15d0bd4c26e98645b3a2a92e",
      "tokenCount": 3
    },
    {
      "sha256": "59af4f15aa453ae59a9901eb7b4eb0c5ab1b8a691ceb041e84ce7e038df2616d",
      "tokenCount": 3
    },
    {
      "sha256": "5aefd8c72285e2f27313484f65575e3e2eaec69199d2c28c441bf0f604dbb0cb",
      "tokenCount": 3
    },
    {
      "sha256": "6870139667fe4946147c678dfdb8e1ae01da9fea10bd61d2a0af48d7921d187b",
      "tokenCount": 3
    },
    {
      "sha256": "6fa13d87eb749dc2b9c7bcee29bc1212f8c8fb50fc8c348f87c3bcc70ff5a38e",
      "tokenCount": 3
    },
    {
      "sha256": "8a50f7d4420920a82059f887df0d6282079158462e8ddea1b629354498b2de9b",
      "tokenCount": 3
    },
    {
      "sha256": "940bd6e293b95a1303f16a270ffc533d501bc7fc643ec36f056164fd8e0c3440",
      "tokenCount": 3
    },
    {
      "sha256": "a5e7f09603eb2d455a521f546a0d792c461a3492f4f79c499a0392ebc4408bc9",
      "tokenCount": 3
    },
    {
      "sha256": "b942c50b576785f5874ca47f1469e0738f155d99d908e3d86c2a66cd45b1fc01",
      "tokenCount": 3
    },
    {
      "sha256": "c440f30b3b204a6eee319d6cc48cbab09dd9279e25295f886b44d3f140427983",
      "tokenCount": 3
    },
    {
      "sha256": "ce825e21dbb20b14f1b15b45f1cd2fe0b86118b3afb13d12e2f9edd67adb0130",
      "tokenCount": 3
    },
    {
      "sha256": "cefb17ee7828f43e33dd6321f2f258c00b0e4c771d9651913aadf4ea51f86590",
      "tokenCount": 3
    },
    {
      "sha256": "cf0ab8dab6df5cc763bd9a0c995bc087e95911a5a9affc1ba32076ab1b232f00",
      "tokenCount": 3
    },
    {
      "sha256": "d56de8bd42bcd2e824bd2de3fde07cef1a6c7f23dc8a701c5ad095722844ee81",
      "tokenCount": 3
    },
    {
      "sha256": "da8290efd10d4cf6be7ff5e0cbfcaf82d3ba4acd7436f47a348e7ecb4d3a846e",
      "tokenCount": 3
    },
    {
      "sha256": "e4fbfc6c90872590f2ccf8c0d6cb1db4b3db541fc5622dcdef892cbcb169ad59",
      "tokenCount": 3
    },
    {
      "sha256": "eefefc263ff2e5b9345aa7fdb17f2aa2bad506ff8e19ccf4d82b525a80c90d89",
      "tokenCount": 3
    },
    {
      "sha256": "f4c14fdf8627f1f236b5a55e365bb197ab582b984e9bbd08a458eec95904a8a1",
      "tokenCount": 3
    },
    {
      "sha256": "fa1cde28d8eea25bfe897dd5b0ac31bf1eb741139006141a2e313cd904f0d9a8",
      "tokenCount": 3
    },
    {
      "sha256": "109e57967ddc17b2da00ca2eba6146824bb050a90aa73568433902530a74f2b1",
      "tokenCount": 4
    },
    {
      "sha256": "128b6060943e466228253d0aadc1fa7f53785650ea536f83350eb736acf235bb",
      "tokenCount": 4
    },
    {
      "sha256": "511fcdddb45c57ca0a8603d852ef8387852cf2da779b05fc9203d1f274cdacd7",
      "tokenCount": 4
    },
    {
      "sha256": "7438101aabe173ab6b5b84c6fa1e92a1a1e359ef41ca87afb241d641ee42c47a",
      "tokenCount": 4
    },
    {
      "sha256": "7a4c72b2dadf4b4db3156bbcc93cc3728021afee37afd5cea4e482903f0c80e6",
      "tokenCount": 4
    },
    {
      "sha256": "917f40029c3d36edfadd0fdb22fa48cf2f51fa171c8970e2213b4ebdcf8492cc",
      "tokenCount": 4
    },
    {
      "sha256": "9bfd4b707b64fbe5f3d756462dc6e1793b7e5cf909115aa34a6b892b2516fd5f",
      "tokenCount": 4
    },
    {
      "sha256": "c21de81c5579376f8dc4d60dac356ef01f17c10a35484f7da6095f2e5064198e",
      "tokenCount": 4
    },
    {
      "sha256": "c41f8ebc8f3418107aac09e953ddc07ee775211482175c119f1f4c819c83178e",
      "tokenCount": 4
    },
    {
      "sha256": "dc3ee336faf2967ec6a7062523ffef42b6f5b6e0ca4861650a4c89bd15d7e9d0",
      "tokenCount": 4
    },
    {
      "sha256": "f9d2ab26d2a02f9bc83b85704c4bfcdbb5f6a226c43af8c638da2e2957d8b7e0",
      "tokenCount": 4
    },
    {
      "sha256": "2bf8d475e9895d7fa5e76d7bccc56d23e5fdaf7395d83912e056ff808142ae77",
      "tokenCount": 5
    },
    {
      "sha256": "a00431742483e188d7c0f6dd9fd6e3e48c385e19c446f7bb2bf99c51b4736db5",
      "tokenCount": 5
    },
    {
      "sha256": "db3ee5fcaa2c467f70a9a03819b3c9919748430247a27a982d1abce7856408a4",
      "tokenCount": 5
    },
    {
      "sha256": "dbce7401a6fb57c82c3a2c3224cb42ad48f82e6930335603bce174713a0a55ef",
      "tokenCount": 5
    },
    {
      "sha256": "e34d394d262f2e73a27e229e1cf6145b752575b2110dd069cf044612aecb9e57",
      "tokenCount": 5
    },
    {
      "sha256": "f71ba6469d130f2d88f31eca9e2f9afdfcef16c7f882658a5fe1850fda4e02b5",
      "tokenCount": 5
    },
    {